leelaz_opencl_tuning
0;XgemmBatched;64;16;64;16; -DKWG=16 -DKWI=2 -DMDIMA=16 -DMDIMC=16 -DMWG=32 -DNDIMB=8 -DNDIMC=8 -DNWG=16 -DSA=1 -DSB=1 -DSTRM=1 -DSTRN=0 -DVWM=2 -DVWN=2;OpenCL: NVIDIA Corporation GeForce GTX 1050 @ 1493MHz
